[
  {
    "id": "aaaa1111-aaaa-4aaa-8aaa-aaaaaaaaaaaa",
    "source_item_id": "22222222-2222-4222-8222-222222222222",
    "workspace_id": "00000000-0000-4000-8000-000000000001",
    "model": "openai:gpt-4o-transcribe-diarize@2026-04-01",
    "language": "en",
    "duration_seconds": 3540.5,
    "cost_usd": 0.42,
    "created_at": "2026-05-19T12:05:00Z",
    "audio_blob_url": "https://blob.example/raw/podcast/142.mp3",
    "audio_retention_until": "2027-05-19",
    "segments": [
      {
        "start": 0.0,
        "end": 4.2,
        "speaker": "S1",
        "text": "Welcome back. Today we are talking about durable runtimes for agents.",
        "confidence": 0.97
      },
      {
        "start": 4.2,
        "end": 9.8,
        "speaker": "S2",
        "text": "The thing nobody warns you about is that interrupt and resume is the hard part, not the model.",
        "confidence": 0.94
      }
    ]
  },
  {
    "id": "aaaa2222-aaaa-4aaa-8aaa-aaaaaaaaaaaa",
    "source_item_id": "33333333-3333-4333-8333-333333333333",
    "workspace_id": "00000000-0000-4000-8000-000000000001",
    "model": "openai:gpt-4o-transcribe-diarize@2026-04-01",
    "language": "en",
    "duration_seconds": 612.0,
    "cost_usd": 0.08,
    "created_at": "2026-05-19T12:05:10Z",
    "audio_blob_url": "https://blob.example/raw/youtube/abc123XYZ.m4a",
    "audio_retention_until": null,
    "segments": [
      {
        "start": 0.0,
        "end": 6.5,
        "speaker": "S1",
        "text": "Three SDKs shipped breaking changes this month. We are walking through each one and what to update.",
        "confidence": 0.96
      }
    ]
  }
]
